,product_name,description,tags
0,Alisha Solid Women's Cycling Shorts,"Key Features of Alisha Solid Women's Cycling Shorts Cotton Lycra Navy, Red, Navy,Specifications of Alisha Solid Women's Cycling Shorts Shorts Details Number of Contents in Sales Package Pack of 3 Fabric Cotton Lycra Type Cycling Shorts General Details Pattern Solid Ideal For Women's Fabric Care Gentle Machine Wash in Lukewarm Water, Do Not Bleach Additional Details Style Code ALTHT_3P_21 In the Box 3 shorts","['woman', 'navy', 'alisha', 'solid', 'cotton', 'short', 'lycra', 'detail']"
1,FabHomeDecor Fabric Double Sofa Bed,"FabHomeDecor Fabric Double Sofa Bed (Finish Color - Leatherette Black Mechanism Type - Pull Out) Price: Rs. 22,646 • Fine deep seating experience • Save Space with the all new click clack Sofa Bed • Easy to fold and vice versa with simple click clack mechanism • Chrome legs with mango wood frame for long term durability • Double cushioned Sofa Bed to provide you with extra softness to make a fine seating experience • A double bed that can easily sleep two,Specifications of FabHomeDecor Fabric Double Sofa Bed (Finish Color - Leatherette Black Mechanism Type - Pull Out) Installation & Demo Installation & Demo Details Installation and demo for this product is done free of cost as part of this purchase. Our service partner will visit your location within 72 business hours from the delivery of the product. In The Box 1 Sofa Bed General Brand FabHomeDecor Mattress Included No Delivery Condition Knock Down Storage Included No Mechanism Type Pull Out Type Sofa Bed Style Contemporary & Modern Filling Material Microfiber Seating Capacity 3 Seater Upholstery Type NA Upholstery Included No Bed Size Double Shape Square Suitable For Living Room Model Number FHD112 Care Instructions Avoid outdoor use and exposure to water or prolonged moisture, Avoid exposure to direct heat or sunlight as this can cause the sofa colour to fade, Keep sharp objects away from your sofa, A little tear on the fabric cover may be hard to repair, Vacuum your sofas periodically with a soft bristled bru...View More Avoid outdoor use and exposure to water or prolonged moisture, Avoid exposure to direct heat or sunlight as this can cause the sofa colour to fade, Keep sharp objects away from your sofa, A little tear on the fabric cover may be hard to repair, Vacuum your sofas periodically with a soft bristled brush attachment or lightly brush them to keep general dirt and dust off the sofa and prevent any embedding between the fibres, Try to avoid food and drink spillage of any kind, If spills occur, do not leave unattended, In case of a stain, a water-free fabric cleaner can be used, However, avoid applying the cleaner directly on the stain as this can cause damage to the fabric and fade colour, Pour the cleaner onto a clean cloth and test its effect on a hidden area of the sofa before cleaning the stain with the cloth, A professional scotchguard treatment is one of the easiest and most effective options to protect against spills or stains and keep pet hair at bay, Getting your sofa professionally cleaned once every 6-8 months will not only take care of the nooks and corners that you can't reach, it will also make it more durable Finish Type Matte Important Note Cancellation NOT allowed for this product after 24 hrs of order booking. Warranty Covered in Warranty Warranty covers all kind of manufacturing defects. Concerned product will either be repaired or replaced based on discretion. Service Type Manufacturer Warranty Warranty Summary 6 Months Domestic Warranty Not Covered in Warranty Warranty does not cover for Improper Handling Dimensions Weight 40 kg Height 838 mm Width 1905 mm Depth 939 mm Disclaimer - The color of the product may vary slightly compared to the picture displayed on your screen. This is due to lighting, pixel quality and color settings - Please check the product's dimensions to ensure the product will fit in the desired location. Also, check if the product will fit through...View More - The color of the product may vary slightly compared to the picture displayed on your screen. This is due to lighting, pixel quality and color settings - Please check the product's dimensions to ensure the product will fit in the desired location. Also, check if the product will fit through the entrance(s) and door(s) of the premises - Please expect an unevenness of up to 5 mm in the product due to differences in surfaces and floor levels - Flipkart, or the Seller delivering the product, will not take up any type of civil work, such as drilling holes in the wall to mount the product. The product will only be assembled in case carpentry assembly is required - In case the product appears to lack shine, wiping the surface with a cloth will help clear the surface of dust particles Material & Color Upholstery Color Leatherette Black Primary Color Black Primary Material Fabric Secondary Material Subtype Mango Wood Secondary Material Foam Finish Color Leatherette Black Primary Material Subtype Foam","['material', 'warranty', 'sofa', 'color', 'type', 'double', 'bed', 'avoid', 'fabric', 'product']"
2,AW Bellies,"Key Features of AW Bellies Sandals Wedges Heel Casuals,AW Bellies Price: Rs. 499 Material: Synthetic Lifestyle: Casual Heel Type: Wedge Warranty Type: Manufacturer Product Warranty against manufacturing defects: 30 days Care instructions: Allow your pair of shoes to air and de-odorize at regular basis; use shoe bags to prevent any stains or mildew; dust any dry dirt from the surface using a clean cloth; do not use polish or shiner,Specifications of AW Bellies General Ideal For Women Occasion Casual Shoe Details Color Red Outer Material Patent Leather Heel Height 1 inch Number of Contents in Sales Package Pack of 1 In the Box One Pair Of Shoes","['material', 'heel', 'warranty', 'use', 'type', 'casual', 'pair', 'belly', 'shoe', 'aw']"
3,Alisha Solid Women's Cycling Shorts,"Key Features of Alisha Solid Women's Cycling Shorts Cotton Lycra Black, Red,Specifications of Alisha Solid Women's Cycling Shorts Shorts Details Number of Contents in Sales Package Pack of 2 Fabric Cotton Lycra Type Cycling Shorts General Details Pattern Solid Ideal For Women's Fabric Care Gentle Machine Wash in Lukewarm Water, Do Not Bleach Additional Details Style Code ALTGHT_11 In the Box 2 shorts","['woman', 'alisha', 'solid', 'cotton', 'short', 'lycra', 'detail', 'fabric']"
4,Sicons All Purpose Arnica Dog Shampoo,Specifications of Sicons All Purpose Arnica Dog Shampoo (500 ml) General Pet Type Dog Brand Sicons Quantity 500 ml Model Number SH.DF-14 Type All Purpose Fragrance Arnica Form Factor Liquid In the Box Sales Package Shampoo Sicons Dog Fashion Arnica,"['dog', 'general', 'purpose', 'arnica', 'specification', 'type', 'ml', 'sicons', 'shampoo']"
5,Eternal Gandhi Super Series Crystal Paper Weights  with Silver Finish,"Key Features of Eternal Gandhi Super Series Crystal Paper Weights  with Silver Finish Crystal  paper weight Product Dimensions :   8cm x  8cm x 5cm A beautiful product Material: Crystal,Eternal Gandhi Super Series Crystal Paper Weights  with Silver Finish (Set Of 1, Clear) Price: Rs. 430 Your office desk will sparkle and shine when you accent tables with this elegant crystal paper weight. The multifaceted crystal features Gandhiji’s bust and his timeless message – “My life is my message – M.K. Gandhi”. A beautiful product to gift to your near and dear ones in family and Business.,Specifications of Eternal Gandhi Super Series Crystal Paper Weights  with Silver Finish (Set Of 1, Clear) General Model Name Gandhi Paper Weight Mark V Dimensions Weight 323 g In the Box Paper Weight Paper Weight Features Paper Weight Material Crystal Paper Weight Finish Silver Finish","['crystal', 'weight', 'paper', 'silver', 'feature', 'eternal', 'series', 'super', 'finish', 'gandhi']"
6,Alisha Solid Women's Cycling Shorts,"Key Features of Alisha Solid Women's Cycling Shorts Cotton Lycra Navy, Red, White, Red,Specifications of Alisha Solid Women's Cycling Shorts Shorts Details Number of Contents in Sales Package Pack of 4 Fabric Cotton Lycra Type Cycling Shorts General Details Pattern Solid Ideal For Women's In the Box 4 shorts Additional Details Style Code ALTGHT4P_26 Fabric Care Gentle Machine Wash in Lukewarm Water, Do Not Bleach","['woman', 'alisha', 'solid', 'cotton', 'short', 'lycra', 'detail', 'red']"
7,FabHomeDecor Fabric Double Sofa Bed,"FabHomeDecor Fabric Double Sofa Bed (Finish Color - Brown Mechanism Type - Pull Out) Price: Rs. 22,646 • Fine deep seating experience • Save Space with the all new click clack Sofa Bed • Easy to fold and vice versa with simple click clack mechanism • Chrome legs with mango wood frame for long term durability • Double cushioned Sofa Bed to provide you with extra softness to make a fine seating experience • A double bed that can easily sleep two,Specifications of FabHomeDecor Fabric Double Sofa Bed (Finish Color - Brown Mechanism Type - Pull Out) Installation & Demo Installation & Demo Details Installation and demo for this product is done free of cost as part of this purchase. Our service partner will visit your location within 72 business hours from the delivery of the product. In The Box 1 Sofa Bed General Brand FabHomeDecor Mattress Included No Delivery Condition Knock Down Storage Included No Mechanism Type Pull Out Type Sofa Bed Style Contemporary & Modern Filling Material Microfiber Seating Capacity 3 Seater Upholstery Type NA Upholstery Included No Bed Size Double Shape Square Suitable For Living Room Model Number FHD107 Care Instructions Avoid outdoor use and exposure to water or prolonged moisture, Avoid exposure to direct heat or sunlight as this can cause the sofa colour to fade, Keep sharp objects away from your sofa, A little tear on the fabric cover may be hard to repair, Vacuum your sofas periodically with a soft bristled bru...View More Avoid outdoor use and exposure to water or prolonged moisture, Avoid exposure to direct heat or sunlight as this can cause the sofa colour to fade, Keep sharp objects away from your sofa, A little tear on the fabric cover may be hard to repair, Vacuum your sofas periodically with a soft bristled brush attachment or lightly brush them to keep general dirt and dust off the sofa and prevent any embedding between the fibres, Try to avoid food and drink spillage of any kind, If spills occur, do not leave unattended, In case of a stain, a water-free fabric cleaner can be used, However, avoid applying the cleaner directly on the stain as this can cause damage to the fabric and fade colour, Pour the cleaner onto a clean cloth and test its effect on a hidden area of the sofa before cleaning the stain with the cloth, A professional scotchguard treatment is one of the easiest and most effective options to protect against spills or stains and keep pet hair at bay, Getting your sofa professionally cleaned once every 6-8 months will not only take care of the nooks and corners that you can't reach, it will also make it more durable Finish Type Matte Important Note Cancellation NOT allowed for this product after 24 hrs of order booking. Warranty Covered in Warranty Warranty covers all kind of manufacturing defects. Concerned product will either be repaired or replaced based on discretion. Service Type Manufacturer Warranty Warranty Summary 6 Months Domestic Warranty Not Covered in Warranty Warranty does not cover for Improper Handling Dimensions Weight 40 kg Height 838 mm Width 1905 mm Depth 939 mm Disclaimer - The color of the product may vary slightly compared to the picture displayed on your screen. This is due to lighting, pixel quality and color settings - Please check the product's dimensions to ensure the product will fit in the desired location. Also, check if the product will fit through...View More - The color of the product may vary slightly compared to the picture displayed on your screen. This is due to lighting, pixel quality and color settings - Please check the product's dimensions to ensure the product will fit in the desired location. Also, check if the product will fit through the entrance(s) and door(s) of the premises - Please expect an unevenness of up to 5 mm in the product due to differences in surfaces and floor levels - Flipkart, or the Seller delivering the product, will not take up any type of civil work, such as drilling holes in the wall to mount the product. The product will only be assembled in case carpentry assembly is required - In case the product appears to lack shine, wiping the surface with a cloth will help clear the surface of dust particles Material & Color Upholstery Color Brown Primary Color Brown Primary Material Fabric Secondary Material Subtype Mango Wood Secondary Material Foam Finish Color Brown Primary Material Subtype Foam","['material', 'warranty', 'sofa', 'color', 'type', 'double', 'bed', 'avoid', 'fabric', 'product']"
8,"dilli bazaaar Bellies, Corporate Casuals, Casuals","Key Features of dilli bazaaar Bellies, Corporate Casuals, Casuals Material: Fabric Occasion: Ethnic, Casual, Party, Formal Color: Pink Heel Height: 0,Specifications of dilli bazaaar Bellies, Corporate Casuals, Casuals General Occasion Ethnic, Casual, Party, Formal Ideal For Women Shoe Details Weight 200 g (per single Shoe) - Weight of the product may vary depending on size. Heel Height 0 inch Outer Material Fabric Color Pink","['material', 'corporate', 'ethnic', 'occasion', 'casuals', 'fabric', 'casual', 'belly', 'dilli', 'bazaaar']"
9,Alisha Solid Women's Cycling Shorts,"Key Features of Alisha Solid Women's Cycling Shorts Cotton Lycra White, Black, Red, Black,Specifications of Alisha Solid Women's Cycling Shorts Shorts Details Number of Contents in Sales Package Pack of 4 Fabric Cotton Lycra Type Cycling Shorts General Details Pattern Solid Ideal For Women's Fabric Care Gentle Machine Wash in Lukewarm Water, Do Not Bleach Additional Details Style Code ALTGHT4P_39 In the Box 4 shorts","['woman', 'alisha', 'black', 'solid', 'cotton', 'short', 'lycra', 'detail']"
10,Ladela Bellies,"Key Features of Ladela Bellies Brand: LADELA Color : Black,Ladela Bellies Price: Rs. 950 Experience the best bellies from the house of Ladela. Providing the best material to keep your feet cozy and active for the whole day.,Specifications of Ladela Bellies General Occasion Casual Ideal For Women Shoe Details Heel Height 0 inch Outer Material PU Color Black","['material', 'color', 'key', 'price', 'ladela', 'feature', 'belly', 'brand', 'black', 'best']"
11,Carrel Printed Women's,"Key Features of Carrel Printed Women's Fabric: SwimLycra Brand Color: Black, White,Carrel Printed Women's Price: Rs. 910 Max-coverage swimwear collection from CARREL BRAND, Brighten up your swim routine with this best fitting. This swimming costume from the house of Carrel is made of imported swim lycra fabric and comes in Black & White Colour. It has to be washed separately and dry in shade. Attractive & classy caressing the water. This swimwear provides excellent protection and Chlorine resistance. fast drying combined with flatlock stitching gives an unmatched comfort and helps you to that performance you have been striving for. This swimwear with its comfort and style is your perfect companion at any pool, beach or water activity. Time for you to do your own thing and Go With The Flow. This Swimwear Lightly padded, for modesty and support. This Product Support To This Size : L, XL, XXL, 3XL,4XL.,Specifications of Carrel Printed Women's Top Details Neck Round Neck Swimsuit Details Fabric SwimLycra Type Swim-dress General Details Pattern Printed Ideal For Women's Occasion Sports Fabric Care Wash with Similar Colors, Use Detergent for Colors In the Box 1 Swimware","['swimlycra', 'swimwear', 'woman', 'printed', 'carrel', 'black', 'brand', 'detail', 'swim', 'fabric']"
13,Alisha Solid Women's Cycling Shorts,"Key Features of Alisha Solid Women's Cycling Shorts Cotton Lycra Black, White, Black,Specifications of Alisha Solid Women's Cycling Shorts Shorts Details Number of Contents in Sales Package Pack of 3 Fabric Cotton Lycra Type Cycling Shorts General Details Pattern Solid Ideal For Women's Fabric Care Gentle Machine Wash in Lukewarm Water, Do Not Bleach Additional Details Style Code ALTHT_3P_17 In the Box 3 shorts","['woman', 'alisha', 'black', 'solid', 'cotton', 'short', 'lycra', 'detail']"
14,Freelance Vacuum Bottles 350 ml Bottle,"Specifications of Freelance Vacuum Bottles 350 ml Bottle (Pack of 1, Green) General Body Material Stainless steel Type Bottle In the Box Number of Contents in Sales Package Pack of 1 Sales Package 1 pcs in one packet","['pack', 'vacuum', 'specification', 'sale', 'bottle', 'freelance', 'package']"
15,Alisha Solid Women's Cycling Shorts,"Key Features of Alisha Solid Women's Cycling Shorts Cotton Lycra Black, White, White,Specifications of Alisha Solid Women's Cycling Shorts Shorts Details Number of Contents in Sales Package Pack of 3 Fabric Cotton Lycra Type Cycling Shorts General Details Pattern Solid Ideal For Women's Fabric Care Gentle Machine Wash in Lukewarm Water, Do Not Bleach Additional Details Style Code ALTHT_3P_2 In the Box 3 shorts","['white', 'woman', 'alisha', 'solid', 'cotton', 'short', 'lycra', 'detail']"
16,FabHomeDecor Fabric Double Sofa Bed,"FabHomeDecor Fabric Double Sofa Bed (Finish Color - Purple Mechanism Type - Pull Out) Price: Rs. 22,646 • Fine deep seating experience • Save Space with the all new click clack Sofa Bed • Easy to fold and vice versa with simple click clack mechanism • Chrome legs with mango wood frame for long term durability • Double cushioned Sofa Bed to provide you with extra softness to make a fine seating experience • A double bed that can easily sleep two,Specifications of FabHomeDecor Fabric Double Sofa Bed (Finish Color - Purple Mechanism Type - Pull Out) Installation & Demo Installation & Demo Details Installation and demo for this product is done free of cost as part of this purchase. Our service partner will visit your location within 72 business hours from the delivery of the product. In The Box 1 Sofa Bed General Brand FabHomeDecor Mattress Included No Delivery Condition Knock Down Storage Included No Mechanism Type Pull Out Type Sofa Bed Style Contemporary & Modern Filling Material Microfiber Seating Capacity 3 Seater Upholstery Type NA Upholstery Included No Bed Size Double Shape Square Suitable For Living Room Model Number FHD132 Care Instructions Avoid outdoor use and exposure to water or prolonged moisture, Avoid exposure to direct heat or sunlight as this can cause the sofa colour to fade, Keep sharp objects away from your sofa, A little tear on the fabric cover may be hard to repair, Vacuum your sofas periodically with a soft bristled bru...View More Avoid outdoor use and exposure to water or prolonged moisture, Avoid exposure to direct heat or sunlight as this can cause the sofa colour to fade, Keep sharp objects away from your sofa, A little tear on the fabric cover may be hard to repair, Vacuum your sofas periodically with a soft bristled brush attachment or lightly brush them to keep general dirt and dust off the sofa and prevent any embedding between the fibres, Try to avoid food and drink spillage of any kind, If spills occur, do not leave unattended, In case of a stain, a water-free fabric cleaner can be used, However, avoid applying the cleaner directly on the stain as this can cause damage to the fabric and fade colour, Pour the cleaner onto a clean cloth and test its effect on a hidden area of the sofa before cleaning the stain with the cloth, A professional scotchguard treatment is one of the easiest and most effective options to protect against spills or stains and keep pet hair at bay, Getting your sofa professionally cleaned once every 6-8 months will not only take care of the nooks and corners that you can't reach, it will also make it more durable Finish Type Matte Important Note Cancellation NOT allowed for this product after 24 hrs of order booking. Warranty Covered in Warranty Warranty covers all kind of manufacturing defects. Concerned product will either be repaired or replaced based on discretion. Service Type Manufacturer Warranty Warranty Summary 6 Months Domestic Warranty Not Covered in Warranty Warranty does not cover for Improper Handling Dimensions Weight 40 kg Height 838 mm Width 1905 mm Depth 939 mm Disclaimer - The color of the product may vary slightly compared to the picture displayed on your screen. This is due to lighting, pixel quality and color settings - Please check the product's dimensions to ensure the product will fit in the desired location. Also, check if the product will fit through...View More - The color of the product may vary slightly compared to the picture displayed on your screen. This is due to lighting, pixel quality and color settings - Please check the product's dimensions to ensure the product will fit in the desired location. Also, check if the product will fit through the entrance(s) and door(s) of the premises - Please expect an unevenness of up to 5 mm in the product due to differences in surfaces and floor levels - Flipkart, or the Seller delivering the product, will not take up any type of civil work, such as drilling holes in the wall to mount the product. The product will only be assembled in case carpentry assembly is required - In case the product appears to lack shine, wiping the surface with a cloth will help clear the surface of dust particles Material & Color Upholstery Color Purple Primary Color Purple Primary Material Fabric Secondary Material Subtype Mango Wood Secondary Material Foam Finish Color Purple Primary Material Subtype Foam","['material', 'warranty', 'sofa', 'color', 'type', 'double', 'bed', 'avoid', 'fabric', 'product']"
17,Style Foot Bellies,"Key Features of Style Foot Bellies ballerina shoes ballerina flats,Style Foot Bellies Price: Rs. 449 ballet shoes that fits perfectly for casual and party wear,Specifications of Style Foot Bellies General Occasion Casual Ideal For Women Shoe Details Heel Height 1 inch Outer Material PU Color Black In the Box 1 slipper","['flat', 'key', 'ballerina', 'style', 'casual', 'feature', 'belly', 'foot', 'shoe']"
18,Carrel Printed Women's,"Key Features of Carrel Printed Women's Fabric: SwimLycra Brand Color: DARK BLUE, WHITE,Carrel Printed Women's Price: Rs. 999 Max-coverage swimwear collection from CARREL BRAND, Brighten up your swim routine with this best fitting. This swimming costume from the house of Carrel is made of imported swim lycra fabric and comes in Darkblue & White Colour. It has to be washed separately and dry in shade. Attractive & classy caressing the water. This swimwear provides excellent protection and Chlorine resistance. fast drying combined with flatlock stitching gives an unmatched comfort and helps you to that performance you have been striving for. This swimwear with its comfort and style is your perfect companion at any pool, beach or water activity. Time for you to do your own thing and Go With The Flow. This Swimwear Lightly padded, for modesty and support. This Product Support To This Size : L, XL, XXL, 3XL,4XL.,Specifications of Carrel Printed Women's Top Details Neck Round Neck Swimsuit Details Fabric SwimLycra Type Swim-dress General Details Pattern Printed Ideal For Women's Occasion Sports Fabric Care Wash with Similar Colors, Use Detergent for Colors In the Box 1 Swimware","['white', 'swimlycra', 'swimwear', 'woman', 'printed', 'carrel', 'brand', 'detail', 'swim', 'fabric']"
