,product_name,description,tags
19,FabHomeDecor Fabric Double Sofa Bed,"FabHomeDecor Fabric Double Sofa Bed (Finish Color - Dark Brown Mechanism Type - Pull Out) Price: Rs. 22,646 • Fine deep seating experience • Save Space with the all new click clack Sofa Bed • Easy to fold and vice versa with simple click clack mechanism • Chrome legs with mango wood frame for long term durability • Double cushioned Sofa Bed to provide you with extra softness to make a fine seating experience • A double bed that can easily sleep two,Specifications of FabHomeDecor Fabric Double Sofa Bed (Finish Color - Dark Brown Mechanism Type - Pull Out) In The Box 1 Sofa Bed Installation & Demo Installation & Demo Details Installation and demo for this product is done free of cost as part of this purchase. Our service partner will visit your location within 72 business hours from the delivery of the product. Important Note Cancellation NOT allowed for this product after 24 hrs of order booking. General Brand FabHomeDecor Mattress Included No Delivery Condition Knock Down Storage Included No Mechanism Type Pull Out Type Sofa Bed Style Contemporary & Modern Filling Material Microfiber Seating Capacity 3 Seater Upholstery Type NA Upholstery Included No Bed Size Double Shape Square Suitable For Living Room Model Number FHD115 Finish Type Matte Care Instructions Avoid outdoor use and exposure to water or prolonged moisture, Avoid exposure to direct heat or sunlight as this can cause the sofa colour to fade, Keep sharp objects away from your sofa, A little tear on the fabric cover may be hard to repair, Vacuum your sofas periodically with a soft bristled bru...View More Avoid outdoor use and exposure to water or prolonged moisture, Avoid exposure to direct heat or sunlight as this can cause the sofa colour to fade, Keep sharp objects away from your sofa, A little tear on the fabric cover may be hard to repair, Vacuum your sofas periodically with a soft bristled brush attachment or lightly brush them to keep general dirt and dust off the sofa and prevent any embedding between the fibres, Try to avoid food and drink spillage of any kind, If spills occur, do not leave unattended, In case of a stain, a water-free fabric cleaner can be used, However, avoid applying the cleaner directly on the stain as this can cause damage to the fabric and fade colour, Pour the cleaner onto a clean cloth and test its effect on a hidden area of the sofa before cleaning the stain with the cloth, A professional scotchguard treatment is one of the easiest and most effective options to protect against spills or stains and keep pet hair at bay, Getting your sofa professionally cleaned once every 6-8 months will not only take care of the nooks and corners that you can't reach, it will also make it more durable Dimensions Weight 40 kg Height 838.2 mm Width 1905 mm Depth 939.8 mm Warranty Covered in Warranty Warranty covers all kind of manufacturing defects. Concerned product will either be repaired or replaced based on discretion. Warranty Summary 6 Months Domestic Warranty Service Type Manufacturer Warranty Not Covered in Warranty Warranty does not cover for Improper Handling Disclaimer - The color of the product may vary slightly compared to the picture displayed on your screen. This is due to lighting, pixel quality and color settings - Please check the product's dimensions to ensure the product will fit in the desired location. Also, check if the product will fit through...View More - The color of the product may vary slightly compared to the picture displayed on your screen. This is due to lighting, pixel quality and color settings - Please check the product's dimensions to ensure the product will fit in the desired location. Also, check if the product will fit through the entrance(s) and door(s) of the premises - Please expect an unevenness of up to 5 mm in the product due to differences in surfaces and floor levels - Flipkart, or the Seller delivering the product, will not take up any type of civil work, such as drilling holes in the wall to mount the product. The product will only be assembled in case carpentry assembly is required - In case the product appears to lack shine, wiping the surface with a cloth will help clear the surface of dust particles Material & Color Primary Material Fabric Primary Color Brown Upholstery Color Dark Brown Secondary Material Foam Secondary Material Subtype Mango Wood Finish Color Dark Brown Primary Material Subtype Foam","['material', 'warranty', 'sofa', 'color', 'type', 'double', 'bed', 'avoid', 'fabric', 'product']"
20,Sicons Conditioning Conditoner Dog Shampoo,Specifications of Sicons Conditioning Conditoner Dog Shampoo (200 ml) General Pet Type Dog Brand Sicons Quantity 200 ml Model Number SH.DF-02 Type Conditioning Fragrance Conditoner Form Factor Gel In the Box Sales Package Shampoo Sicons Dog Fashion Conditioner Aloe Rinse,"['dog', 'general', 'specification', 'type', 'conditoner', 'ml', 'sicons', 'shampoo']"
22,dongli Printed Boy's Round Neck T-Shirt,"Specifications of dongli Printed Boy's Round Neck T-Shirt (Pack of 4) T-shirt Details Sleeve Half Sleeve Number of Contents in Sales Package Pack of 4 Fabric Cotton Type Round Neck Fit Regular General Details Pattern Printed Occasion Casual Ideal For Boy's In the Box 4 T Shirt Additional Details Style Code DLHBB445_BEIGE_BLACK_GYELLOW_PURPLE Fabric Care Wash with Similar Colors, Use Detergent for Colors","['boy', 'shirt', 'pack', 'sleeve', 'printed', 'neck', 'detail', 'round', 'fabric']"
23,SWAGGA Women Clogs,"Key Features of SWAGGA Women Clogs Occasion: Ethnic Material: Leather Color: Brown, White Heel Height: 0,Specifications of SWAGGA Women Clogs General Occasion Ethnic Ideal For Women Sandal Details Type Clogs Heel Height 0 inch Outer Material Leather Color Brown, White13","['clog', 'material', 'heel', 'woman', 'brown', 'color', 'swagga', 'ethnic', 'occasion', 'leather']"
24,Kennel Rubber Dumbell With Bell - Small Rubber Rubber Toy For Dog,Buy Kennel Rubber Dumbell With Bell - Small Rubber Rubber Toy For Dog for Rs.190 online. Kennel Rubber Dumbell With Bell - Small Rubber Rubber Toy For Dog at best prices with FREE shipping & cash on delivery. Only Genuine Products. 30 Day Replacement Guarantee.,"['dog', 'small', 'rubber', 'toy', 'dumbell', 'bell', 'buy', 'kennel']"
30,Bengal Blooms Rose Artificial Plant  with Pot,"Key Features of Bengal Blooms Rose Artificial Plant  with Pot Assorted Height: 30 cm,Bengal Blooms Rose Artificial Plant  with Pot (30 cm, Multicolor) Price: Rs. 579 The Bengal Blooms Decor your home with artificial flowers attached to a wonderful pot.,Specifications of Bengal Blooms Rose Artificial Plant  with Pot (30 cm, Multicolor) General Brand Bengal Blooms Model Number BBAJC218 Type Assorted Bonsai No Model Name Rose Color Multicolor Pot Features Pot Included Yes Dimensions Total Height 30 cm In the Box Sales Package 1 Assorted Artificial plant with Pot","['plant', 'artificial', 'bloom', 'cm', 'assorted', 'multicolor', 'bengal', 'rose', 'pot']"
31,Indcrown Net Embroidered Semi-stitched Lehenga Choli Material,"Key Features of Indcrown Net Embroidered Semi-stitched Lehenga Choli Material Ghagra Choli , Ghagra, Choli, Dupatta Set , Lehenga Choli , Lehenga, Choli and Dupatta Set .,Indcrown Net Embroidered Semi-stitched Lehenga Choli Material (Semi-stitched) Price: Rs. 699 We have not authorised any other seller to sell our brand Indcrown . Any seller doing so is selling fake Indcrown Products. Buy original Indcrown products from the seller "" indcrown‘’ only,Specifications of Indcrown Net Embroidered Semi-stitched Lehenga Choli Material (Semi-stitched) Fabric Details Fabric Net Type Semi-stitched Lehenga Choli Material General Details Pattern Embroidered Ideal For Women's Color Multicolor Fabric Care Dry clean or else Normal Hand Wash Additional Details Other Details Lehnga Choli is an Indian traditional ware also known as Chaniya Choli. We at Bolly Lounge offers you to attract compliments by this attractive Lehnga Choli made with fine quality material and beautiful work which can be worn for functions, festivals, parties and even office also. This Lehnga Choli ...View More Lehnga Choli is an Indian traditional ware also known as Chaniya Choli. We at Bolly Lounge offers you to attract compliments by this attractive Lehnga Choli made with fine quality material and beautiful work which can be worn for functions, festivals, parties and even office also. This Lehnga Choli is comes with unstitched material so it can be stitched according to your taste and preference. Stunning Self Designed Partywear Salwar Suit Gives A Trendy Look. Suit Having Fine Embroidery Work Over All. A Fine Fabric Used To Make It, It Will Be Comfortable In All Season. Style Code R C Lehe Bt In the Box 1 Lehenga Choli And Duppta Set","['choli', 'material', 'stitched', 'net', 'indcrown', 'fabric', 'lehnga', 'embroidered', 'lehenga', 'semi']"
32,Shopmania Music Band A5 Notebook Spiral Bound,"Specifications of Shopmania Music Band A5 Notebook Spiral Bound (Multicolor) General Ruling Ruled Model id NB00664 Type Notebook GSM 75 Cover Type 300 GSM Hard Laminated Cover No. of Pages 160 Brand Name Shopmania Binding Spiral Bound Color Multicolor Size A5 Dimensions Length 9 inch Width 6 inch Special Features Can be used as Notepad, Diary, Writing pad In the Box Sales Package 1 Notebook","['inch', 'type', 'cover', 'a5', 'gsm', 'bound', 'multicolor', 'notebook', 'shopmania', 'spiral']"
33,Shopmania Music Band A5 Notebook Spiral Bound,"Specifications of Shopmania Music Band A5 Notebook Spiral Bound (Multicolor) General Ruling Ruled Model id NB00678 Type Notebook GSM 75 Cover Type 300 GSM Hard Laminated Cover No. of Pages 160 Brand Name Shopmania Binding Spiral Bound Color Multicolor Size A5 Dimensions Length 9 inch Width 6 inch Special Features Can be used as Notepad, Diary, Writing pad In the Box Sales Package 1 Notebook","['inch', 'type', 'cover', 'a5', 'gsm', 'bound', 'multicolor', 'notebook', 'shopmania', 'spiral']"
34,"Tiara Diaries 2016-2017 Designer LA Kaarta ""TAKING ACTION GETTING RESULT"" (Set of 3) B5 Notebook Hard Bound","Specifications of Tiara Diaries 2016-2017 Designer LA Kaarta ""TAKING ACTION GETTING RESULT"" (Set of 3) B5 Notebook Hard Bound (Coffee, Pack of 3) General Ruling ruled Model id 244 Type Notebook No. of Pages 216 Brand Name Tiara Diaries Binding Hard Bound Size B5 Color Coffee","['hard', 'specification', 'tiara', 'b5', 'diary', 'bound', 'coffee', 'notebook']"
35,KAJCI Embroidered Women's Waistcoat,Specifications of KAJCI Embroidered Women's Waistcoat General Details Pattern Embroidered Ideal For Women's Waistcoat Details Fabric Art Silk In the Box Waistcoat Additional Details Style Code LKOD112 Fabric Care Dry Clean Only,"['general', 'woman', 'kajci', 'specification', 'ideal', 'pattern', 'embroidered', 'waistcoat', 'detail', 'fabric']"
36,Packman 8 x 10 inches Security Bags Without POD Jacket Courier Bag Security Bag,"Key Features of Packman 8 x 10 inches Security Bags Without POD Jacket Courier Bag Security Bag Supplying to Over 200 Companies around world International E-commerce Standard Direct From ISO 9002 Factory 60 Microns High Quality Bags Longer Lasting Protection,Packman 8 x 10 inches Security Bags Without POD Jacket Courier Bag Security Bag (21.59 x 27.95 Pack of 100) Price: Rs. 298 Courier Bag,Specifications of Packman 8 x 10 inches Security Bags Without POD Jacket Courier Bag Security Bag (21.59 x 27.95 Pack of 100) General Bubble Wrap Present No Brand Packman Model Number 8 x 10 inches Security Bags Without POD Jacket Courier Bag Water Resistant Yes Tamper Proof Yes Material Plastic POD Jacket Available No Color Grey Size 21.59 x 27.95 Dimensions Weight 600 g Other Dimensions 8 x 10 Thickness 60 micron Additional Features Other Features security bag In the Box Sales Package 1 pack contains 100 pcs Pack of 100","['security', 'courier', 'bag', 'packman', 'jacket', 'pod']"
37,Pick Pocket Embroidered Women's Waistcoat,Specifications of Pick Pocket Embroidered Women's Waistcoat General Details Pattern Embroidered Occasion Casual Ideal For Women's Waistcoat Details Lining Polyester Fabric Bengal Silk Additional Details Style Code TL-012 Fabric Care First Time Dry Clean,"['pocket', 'woman', 'general', 'pick', 'specification', 'pattern', 'embroidered', 'waistcoat', 'detail', 'fabric']"
38,Angelfish Silk Potali Potli,"Angelfish Silk Potali Potli (Multicolor) Price: Rs. 399 Made by silk Fabric with fancy lace adnored and stylish handle also.(set of 2 piece),Specifications of Angelfish Silk Potali Potli (Multicolor) General Closure Velcro Type Potli Material Fabric Style Code AELKABJ01224-A Ideal For Girls Bag Size Small Occasion Party Color Code Multicolor Dimensions Weight 200 g Body Features Number of Compartments 1","['code', 'price', 'potli', 'potali', 'fabric', 'multicolor', 'silk', 'angelfish']"
39,Oye Boy's Dungaree,Specifications of Oye Boy's Dungaree Top Details Number of Contents in Sales Package Pack of 1 Fabric Cotton Type Dungaree General Details Pattern Solid Ideal For Boy's In the Box 1 Dungaree,"['boy', 'oye', 'specification', 'number', 'top', 'sale', 'detail', 'content', 'dungaree']"
40,Nuride Canvas Shoes,"Key Features of Nuride Canvas Shoes Material: Canvas Occasion: Casual Color: Red Heel Height: 0.5,Specifications of Nuride Canvas Shoes General Occasion Casual Ideal For Women Shoe Details Heel Height 0.5 inch Outer Material Canvas Color Red","['material', 'height', 'heel', 'canvas', 'color', 'occasion', 'casual', 'nuride', 'shoe', 'red']"
41,OM SHIVAKRITI Square wall Clock Showpiece  -  38.1 cm,"Key Features of OM SHIVAKRITI Square wall Clock Showpiece  -  38.1 cm Paper Mache Height - 38.1 cm Width - 38.1 cm,OM SHIVAKRITI Square wall Clock Showpiece  -  38.1 cm (Paper Mache, Multicolor) Price: Rs. 1,499 Omshivakriti brings you this square wall watch made from paper mache and finished in attractive set of colors. The product in display is ideal to décor your home.,Specifications of OM SHIVAKRITI Square wall Clock Showpiece  -  38.1 cm (Paper Mache, Multicolor) General Brand OM SHIVAKRITI Model Number OSK60 Type Antique Material Paper Mache Model Name Square wall Clock Color Multicolor Dimensions Height 38.1 cm Width 38.1 cm Depth 3.81 cm In the Box Sales Package 1 showpiece","['mache', 'shivakriti', 'clock', 'paper', 'square', 'wall', 'om', 'cm']"
42,Himmlisch ST381 Magnetic Sun Shade For Maruti Alto,"Himmlisch ST381 Magnetic Sun Shade For Maruti Alto (Side Window) Price: Rs. 1,899 Beat the heat this summer and feel like a VIP with Himmlisch Car Window Magnetic Sunshades. These magnetic sunshades create a mesh layer to stops the heat. Magnet border gets easily stick to your car window door edges (No need of Suction cups) Features: Block UV Rays Keeps Car Cool Easy to install and remove Durable and Exact Fit Provides Complete privacy Resists Heat Mesh Type Sunshade Package Contents: 1 x Set Of 4 Magnetic Sunshades,Specifications of Himmlisch ST381 Magnetic Sun Shade For Maruti Alto (Side Window) General Brand Himmlisch Model Number ST381 Magnetic Placement Position Side Window Color Black Dimensions Weight 4000 g Depth 1.1 cm In the Box Sales Package 4 Sun Shade Pack of 4","['window', 'sun', 'himmlisch', 'side', 'magnetic', 'car', 'st381', 'heat', 'shade']"
43,Rapter BNC-179 BNC Wire Connector,"Rapter BNC-179 BNC Wire Connector (Silver, Pack of 100) Price: Rs. 1,400 Rapter Pack of 100 BNC Connector.Superior quality BNC Connectors with high quality outer metel and brass conductors used to maintain a proper video/signal quality.BNC normally used in co-axial cables to lock with female connectors which ensures permanancy of connection.They can be used in DVRs, NVRs and CCTV Cameras etc.,Specifications of Rapter BNC-179 BNC Wire Connector (Silver, Pack of 100) General Brand Rapter Suitable For Wire to Wire Connection, Wire to Circuit Board Connection Model Number BNC-179 Type BNC Waterproof Yes Corrosion Proof Yes Color Silver In the box Sales Package 100 BNC Connector Pack of 100","['pack', 'quality', 'silver', 'used', 'connector', 'wire', 'bnc', 'rapter']"
44,Vishudh Printed Women's Straight Kurta,"Specifications of Vishudh Printed Women's Straight Kurta Kurta Details Sleeve Sleeveless Number of Contents in Sales Package Pack of 1 Fabric 100% Cotton Type Straight Neck ROUND NECK General Details Pattern Printed Occasion Festive Ideal For Women's In the Box Kurta Additional Details Style Code VNKU004384 NAVY BLUE Fabric Care Gentle Machine Wash in Lukewarm Water, Do Not Bleach","['woman', 'straight', 'specification', 'sleeve', 'printed', 'vishudh', 'neck', 'detail', 'fabric', 'kurta']"
45,Vishudh Printed Women's Straight Kurta,"Specifications of Vishudh Printed Women's Straight Kurta Kurta Details Sleeve Sleeveless Number of Contents in Sales Package Pack of 1 Fabric 100% POLYESTER Type Straight Neck ROUND NECK General Details Pattern Printed Occasion Festive Ideal For Women's In the Box Kurta Additional Details Style Code VNKU004370 PINK::OLIVE Fabric Care Gentle Machine Wash in Lukewarm Water, Do Not Bleach","['woman', 'straight', 'specification', 'sleeve', 'printed', 'vishudh', 'neck', 'detail', 'fabric', 'kurta']"
46,Vishudh Printed Women's Anarkali Kurta,"Specifications of Vishudh Printed Women's Anarkali Kurta Kurta Details Sleeve Half Sleeve Number of Contents in Sales Package Pack of 1 Fabric 100% Cotton Type Anarkali Neck ROUND NECK General Details Pattern Printed Occasion Festive Ideal For Women's In the Box Kurta Additional Details Style Code VNKU004389 BEIGE::PINK Fabric Care Gentle Machine Wash in Lukewarm Water, Do Not Bleach","['woman', 'sleeve', 'specification', 'printed', 'fabric', 'vishudh', 'neck', 'detail', 'anarkali', 'kurta']"
47,BuildTrack PIR Wireless Motion Sensor - One Switch Control Wireless Sensor Security System,"Key Features of BuildTrack PIR Wireless Motion Sensor - One Switch Control Wireless Sensor Security System National Award Winning Product Long Battery Life Freely Placed Low Power Consumed,BuildTrack PIR Wireless Motion Sensor - One Switch Control Wireless Sensor Security System Price: Rs. 5,000 Buildtrack's Wireless Motion Sensor turns your existing light switches off when you leave the room and turns them on when you return. This model is ideal for fitting on a ceiling. It is battery powered and will work with One Single Switch. Using Wireless Motion Sensor stops Wastage of Energy and Lower your Electricity Bills. It is highly suitable for homes, institutions, banks, offices and healthcare. • Saves Energy • Lowers electricity bills • National Award Winning Product • Adds convenience • Works with existing switches, no re – wiring • Quick and easy installation • Freely placed • Long battery life • Single device for multiple switches • No aesthetic changes / No external wiring • Adjustable time delay for turning off,Related video of BuildTrack PIR Wireless Motion Sensor - One Switch Control Wireless Sensor Security System,Specifications of BuildTrack PIR Wireless Motion Sensor - One Switch Control Wireless Sensor Security System General Detection Angle 360 degree Brand BuildTrack Brand Color Off White Suitable For Homes, Offices, Intermittent Spaces, Warehouses, Industrial Spacing Wired/Wireless Wireless Display Type NA Installation Type Plug and Play, Simply Attached to the Ceiling Model Number PIR Wireless Motion Sensor - One Switch Control Audible Alarm No Maximum Alarm Distance 0 m Minimum Alarm Distance 0 m Detection Range 10 ft Number of Sensors 1 Color White Dimensions Weight 200 g Other Dimensions 106x106x71 mm Warranty Service Type Manufacturer's Warranty - 1 Year In the Box Wireless Motion Detector | Actuator | User Manual | Warranty Card Additional Features Other Features Saves Energy, Lowers Electricity Bills, Adds Convenience, Works with Existing Switches, No Re – Wiring, Quick and Easy Installation, Single Device for Multiple Switches, No Aesthetic Changes / No External Wiring, Adjustable Time Delay for Turning Off Technology Used Passive Infra Red (PIR)","['wireless', 'security', 'motion', 'control', 'switch', 'one', 'buildtrack', 'sensor', 'pir']"
48,Skayvon SUMMERSIBLE SINGLE PHASE PUMP CONTROLLER Wired Sensor Security System,"Key Features of Skayvon SUMMERSIBLE SINGLE PHASE PUMP CONTROLLER Wired Sensor Security System Dry run protection L/H Voltage protection Corrosion free sensors Has Manual/Auto mode,Skayvon SUMMERSIBLE SINGLE PHASE PUMP CONTROLLER Wired Sensor Security System Price: Rs. 4,990 ""This system is suitable for single phase submersible pump. The sytem auto start the submersible pump when water level in tank reaches preset lower level and auto switch off the pump when tank gets full.Upper and lower level is adjustable as per user choice. The system indicates 4 different levels of water (¼ , ½, ¾, and Full) of overhead tank. The system has Auto /manual switch."",Related video of Skayvon SUMMERSIBLE SINGLE PHASE PUMP CONTROLLER Wired Sensor Security System,Specifications of Skayvon SUMMERSIBLE SINGLE PHASE PUMP CONTROLLER Wired Sensor Security System In the Box 1 pack of Skayvon SUMMERSIBLE SINGLE PHASE PUMP CONTROLLER General Brand Skayvon Model Number SUMMERSIBLE SINGLE PHASE PUMP CONTROLLER Wired/Wireless Wired Number of Sensors 4 Brand Color Ivory Display Type LED Audible Alarm NO Installation Type Cabling Detection Range 987 ft Minimum Alarm Distance 10 m Maximum Alarm Distance 98 m Color Silver LED Indicators Yes","['system', 'summersible', 'controller', 'sensor', 'wired', 'security', 'phase', 'single', 'pump', 'skayvon']"
49,MASARA Solid Women's Straight Kurta,"Key Features of MASARA Solid Women's Straight Kurta Green Straight,MASARA Solid Women's Straight Kurta Price: Rs. 599 The knee length kurti with raindrop pattern with subtle colors will completely transform your look at your work place. Soft cotton fabric used in this kurti is to die for.,Specifications of MASARA Solid Women's Straight Kurta Kurta Details Sleeve 3/4 Sleeve Fabric Cotton Type Straight Neck Round General Details Pattern Solid Occasion Casual Ideal For Women's Additional Details Style Code M002PCOTSEARAIN","['masara', 'woman', 'straight', 'pattern', 'solid', 'kurti', 'cotton', 'detail', 'fabric', 'kurta']"
